ticket_id,description,cleaned_description,entities,sentiment_score,sentiment_label,order_number,intent
93,Games it self are good but had to switch to ad free  original angry birds . Didn't like the ads interfering with the game.,game self good switch ad free   original angry bird like ad interfere game,[],0.536,pos,,return_request
94,got thr upgrade it was soooooooooooooooooo. fun lille fish not going to tell much get it it is free and fun,get thr upgrade soooooooooooooooooo fun lille fish go tell free fun,[],0.645,pos,,positive_feedback
95,"Hey it's Angry Birds, what's not to love!  Easy to use on my new Kindle HD and I could spend hours being angry at those dang birds for not stomping those pigs, first shot!",hey angry bird love   easy use new kindle hd spend hour angry dang bird stomp pig shot,"[('Angry Birds', 'ORG'), ('hours', 'TIME')]",0.698,neu,,positive_feedback
96,"I can't believe how  hard I try to hit the target and still can't make it, it's good to laugh at oneself and this game is good for that",believe   hard try hit target good laugh oneself game good,[],0.7,pos,,inquiry
97,I didn't like it at all .I think it is more for kids. I am really not into many games,like .i think kid game,[],0.9,neu,,return_request
98,"I got to the end of he pre-installed version. Confused, I checked online to see that my app was missing an entire level. One post suggested downloading a newer version. It crashes moments after it starts.",get end pre installed version confuse check online app miss entire level post suggest download new version crash moment start,"[('One', 'CARDINAL')]",0.883,neu,,negative_feedback
99,I hate it they say no at everything l got rid of it when it shut down my kindle it is stupid! !!!!!!!!!????$$$$$*&#9733;&#9733;*&#9733;,hate l get rid shut kindle stupid $ $ $ $ $ 9733;&#9733;*&#9733,"[('everything l got rid', 'ORG'), ('$$$$$*', 'MONEY'), ('9733;&#9733;*&#9733', 'MONEY')]",0.568,neu,9733,negative_feedback
