ticket_id,description,cleaned_description,entities,sentiment_score,sentiment_label,order_number,intent
1,"Ugh, fine. You need a return label for that stupid product? Here it is #58923. Just take it",ugh fine need return label stupid product 58923,"[('58923', 'MONEY')]",0.652,neg,58923,return_request
2,Thank you for the quick response. I'm satisfied with the service.,thank quick response satisfied service,[],0.629,pos,,positive_feedback
3,The website is not loading properly. Please fix it ASAP.,website load properly fix asap,[],0.821,neu,,general_comment
4,I need to return a product. Can you send me the return label?,need return product send return label,[],1.0,neu,,return_request
5,"Ugh, seriously? This is the best you could come up with?",ugh seriously good come,[],0.469,neg,,general_comment
6,Can you help me track my order from Amazon?,help track order amazon,"[('Amazon', 'ORG')]",0.614,pos,,inquiry
7,This is  the best apps acording to a bunch of people and I agree it has bombs eggs pigs TNT king pigs and realustic stuff,  good app acorde bunch people agree bomb egg pig tnt king pig realustic stuff,"[('TNT', 'ORG')]",0.774,neu,,general_comment
8,This is a pretty good version of the game for being free. There are LOTS of different levels to play. My kids enjoy it a lot too.,pretty good version game free lot different level play kid enjoy lot,"[('LOTS', 'ORG')]",0.595,pos,,positive_feedback
9,this is a really . there are a bunch of levels and you can find golden eggs. super fun.,bunch level find golden egg super fun,[],0.702,pos,,positive_feedback
10,"This is a silly game and can be frustrating, but lots of fun and definitely recommend just as a fun time.",silly game frustrating lot fun definitely recommend fun time,[],0.497,pos,,positive_feedback
11,This is a terrific game on any pad. Hrs of fun.  My grandkids love it. Great entertainment when waiting in long lines,terrific game pad hrs fun   grandkid love great entertainment wait long line,[],0.507,pos,,positive_feedback
12,This is a very entertaining game!  You don't have to be smart to play it.  I guess that's why I like it...it's easy and fun and that's what games are suppose to be.  Be warned: this game is highly addictive.,entertaining game   smart play   guess like easy fun game suppose   warn game highly addictive,[],0.63,pos,,positive_feedback
13,this is awesome and you don't need wi ti to play trust me. it is really fun and addicting. there are like 100 levels it is even free don't waste your money on the expensive one I mean seriously. get the app,awesome need wi ti play trust fun addicting like 100 level free waste money expensive mean seriously app,"[('100', 'CARDINAL')]",0.594,pos,,positive_feedback
14,this is awesome I bet no one even reads the reviews because they know this game is so good that they don't need to,awesome bet read review know game good need,[],0.677,pos,,positive_feedback
15,This is basicly the free version but with ads. That's actually awesome!!!! It's addicting and free at the same time really. I'd reccomend it.,basicly free version ad actually awesome addict free time reccomend,[],0.61,pos,,positive_feedback
16,this is by far the best free app that is available anywhere. it has helped pass the time when nothing else would do. don't pass this one up. PS I hate this 20 word minimum!,far well free app available help pass time pass ps hate 20 word minimum,"[('PS', 'ORG'), ('20', 'CARDINAL')]",0.736,neu,,negative_feedback
17,"This is definitely a great  to get my 6-year-old grand-nephew to teach me the tricks.  I have figured out some of them, but some configurations are tough to beat.  I don't particularly care spending about 45 minutes  completing a level, but ",definitely great   6 year old grand nephew teach trick   figure configuration tough beat   particularly care spend 45 minute   complete level,"[('6-year-old', 'DATE'), ('about 45 minutes', 'TIME')]",0.763,neu,,positive_feedback
18,this. is fun an time consuming. works great on my kindle fire I really like this game so does my btother,fun time consume work great kindle fire like game btother,[],0.574,pos,,positive_feedback
19,"This is good if you like physics games, free games, or bird games. Not like free version on ipod. You get all the levels and the only adds pop up in the corner and are barely noticeable.",good like physics game free game bird game like free version ipod level add pop corner barely noticeable,[],0.703,pos,,general_comment
20,This is great! This is my tried & true game to cure boredom! Its great to try & get 3 stars on every level!,great tried true game cure boredom great try 3 star level,"[('3', 'CARDINAL')]",0.585,pos,,positive_feedback
21,this is one of the best apps in the world along with all the other angry birds games. great for passing time by.,good app world angry bird game great pass time,[],0.633,pos,,positive_feedback
22,This is super fun though a little frustrating at times!!!! I loved it before I got my kindle I would beg my brother and dad to play. But when I get it I play it all the time!!!!!!,super fun little frustrating time love get kindle beg brother dad play play time,[],0.683,pos,,positive_feedback
23,"this is the ad free version of angry birds. this is the old fashioned version of the angry birds series. it is s huge and partially difficult game. if you have played angry birds before or this is the first time, you'll love it",ad free version angry bird old fashioned version angry bird series s huge partially difficult game play angry bird time love,"[('first', 'ORDINAL')]",0.594,neu,,positive_feedback
24,This is the best app ever. It makes it way easier to babysitt a mental kid. this app is very fun.,good app make way easy babysitt mental kid app fun,[],0.63,pos,,positive_feedback
25,this is the best app I ever downloaded for most of you people who say 1 2 3 or 4 stars you don't know much about what your supposed to do I purfor 5 stars for this app,good app download people 1 2 3 4 star know suppose purfor 5 star app,"[('1', 'CARDINAL'), ('4', 'CARDINAL'), ('5', 'CARDINAL')]",0.898,neu,,general_comment
26,THIS IS THE BESTEST GAME EVER OMG. IM SO EXCITED :TO PLAY OMG!!!!!!! OMG OMG OMG I LOVE ANGRY BIRDS SO MUCH ITS DA BOMB DIGGETY SO COOL OMG OMG OMG OMG OMG,best game omg m excited play omg omg omg omg love angry bird da bomb diggety cool omg omg omg omg omg,[],0.572,pos,,positive_feedback
27,This is the best game ever!!!!!  it is so fun and addicting. there is so many different episodes that are amazing. love it!,good game   fun addicting different episode amazing love,[],0.519,pos,,positive_feedback
28,this is the BEST game ever you should buy it the most awesome game in the whole wide world.  :D,good game buy awesome game wide world   d,[],0.56,pos,,positive_feedback
29,this is the best game they could think of.I downloaded it and my fav. character is the original pig.yay love it,good game think of.i download fav character original pig.yay love,[],0.554,pos,,positive_feedback
30,this is the first angry birds. so when you get in2 this one it'll leas to you wanting angry birds seasons and angry birds Rio. But they're all fantastic!!!!!!!!,angry bird in2 leas want angry bird season angry bird rio fantastic,"[('first', 'ORDINAL'), ('Rio', 'ORG')]",0.666,neg,,general_comment
31,"This is the first app that I installed onKindle Fire, Full Color 7"" Multi-touch Display, Wi-Fiwhich I purchased recently from Amazon. Angry Birds (free version) works smoothly on Kindle fire.Love the smooth graphics! It responds perfectly and It is a ple",app instal onkindle fire color 7 multi touch display wi fiwhich purchase recently amazon angry bird free version work smoothly kindle fire.love smooth graphic respond perfectly ple,"[('first', 'ORDINAL'), ('Fire, Full Color', 'FAC'), ('Amazon', 'ORG'), ('Angry Birds', 'ORG'), ('Kindle', 'GPE')]",0.703,neu,,positive_feedback
32,"this is the full version except it has ads. It is one of the best free apps on the app store. For IOS, the free version is like a demo. This is a better buy. You save 99 cents on the exact same thing as the paid version. I recommend it to everyone. A mus",version ad well free app app store io free version like demo well buy save 99 cent exact thing pay version recommend mus,"[('IOS', 'ORG'), ('99 cents', 'MONEY')]",0.687,pos,,general_comment
33,this is the game to get. those other bad comments r stupid. this app doesn't need wifi.  I like this app a lot its free and who doesn't love angry birds!!!,game bad comment r stupid app need wifi   like app lot free love angry bird,[],0.56,neg,,positive_feedback
34,this is the go to game for me... love it.  I find this much better than most other games out there,game love   find well game,[],0.728,pos,,positive_feedback
35,this is the one of the best apps becase it is a good time consuming games were ever you go becase you do not wifi,good app becase good time consume game becase wifi,[],0.764,neu,,general_comment
36,"This is the original anfry birds game but it only works on the original Kindle Fire and not on the new HD version.NEW NOTE - This has now been updated to work on the new Kindle Fire HD. Of course that did not happen until I bought the paid version, but n",original anfry bird game work original kindle fire new hd version.new note update work new kindle fire hd course happen buy pay version n,"[('Kindle Fire', 'LOC'), ('Kindle Fire HD', 'FAC')]",0.816,neu,,general_comment
37,"This is very popular game I've been hearing for a long time till my friends dared me to download it and play it.  Be damned that I got addicted to this game.  I love it so much.  I just turned my husband into this game, too.  Soon, I'll get my son on it,",popular game hear long time till friend dare download play   damn get addict game   love   turn husband game   soon son,[],0.757,neu,,positive_feedback
38,"This keeps me busy all the time. I am really happy about this app, I have never ever had any problems.P.S.Good luck with those green little boogers!",keep busy time happy app problems.p.s.good luck green little booger,[],0.774,neu,,negative_feedback
39,This physics based game is perfect for people of all ages to spend extra time on a mobile device. Yet it still offers some challenge. It works very well on the kindle fire.,physics base game perfect people age spend extra time mobile device offer challenge work kindle fire,[],0.748,neu,,general_comment
40,"This seems to be popular when my kindle fire is out of my hands.  Lots of fun and free time for me plus the graphics are very, very nice.",popular kindle fire hand   lot fun free time plus graphic nice,[],0.613,pos,,positive_feedback
41,This so much fun! My daughter has vthis app for her IPhone but I never realized how much fun it is until I downloaded for my Kindle Fire. I highly recommend getting this app...works great on the Kindle Fire!,fun daughter vthis app iphone realize fun download kindle fire highly recommend get app work great kindle fire,"[('Kindle Fire', 'LOC'), ('the Kindle Fire', 'LOC')]",0.591,pos,,positive_feedback
42,"This was a very entertaining and challenging game with several levels to seek improvement. The ads did not overrun it and, for free, this was an excellent program.",entertaining challenging game level seek improvement ad overrun free excellent program,[],0.604,pos,,general_comment
43,"This was my first time to play Angry Birds and I don'tthink I could have had a better first impression!  Because of this, I will purchase every Angry Birds gameI can get my hands on!  Now I see what all the 'fuss' is about!!!",time play angry bird don'tthink well impression   purchase angry bird gamei hand   fuss,"[('first', 'ORDINAL'), ('Angry Birds', 'WORK_OF_ART'), ('first', 'ORDINAL')]",0.723,neg,,general_comment
44,this was one of the first apps I got on my kindle fire and I love playing it. it is great for passing the time. the ads don't bother me at all they are in a small little box at the top right of the screen and I hardly notice them. it is not worth paying ,app get kindle fire love play great pass time ad bother small little box right screen hardly notice worth pay,"[('first', 'ORDINAL')]",0.731,neu,,positive_feedback
45,This was the 1st app I ever downloaded on my Kindle Fire and I LOVE it! And you do not need wi-fi to play it!  I think it's a great app and time-waster.,1st app download kindle fire love need wi fi play   think great app time waster,"[('1st', 'ORDINAL'), ('Kindle Fire', 'LOC')]",0.668,neu,,positive_feedback
46,this was the best game of all time to come to a phone. I would put it up there with snake on the old nokia bricks.,good game time come phone snake old nokia brick,"[('nokia bricks', 'FAC')]",0.856,neu,,general_comment
47,"Very addictive. I can play this for hours. The first game I installed to my fire, and my most played.",addictive play hour game instal fire play,"[('this for hours', 'TIME'), ('first', 'ORDINAL')]",0.694,pos,,general_comment
48,"Very fun and challenges you, I always try and get three stars, nice graphics and gameplay, always a good way to kill time.",fun challenge try star nice graphic gameplay good way kill time,"[('three', 'CARDINAL')]",0.536,pos,,positive_feedback
49,Very fun and very addictingSo good u should pay money for itOnly winners play this game so get it!!!!!!!!!!!!!!!!!!!!!!!,fun addictingso good u pay money itonly winner play game,[],0.485,pos,,positive_feedback
50,very fun game and all the other people who say it freezes and don't work you must have to many games on you're. device,fun game people freeze work game device,[],0.824,neu,,positive_feedback
51,"very fun very fun very fun very fun, keeps me busy. I cannot stop playing. very challenging,  this game can make you angry,sometimes , but then I win.",fun fun fun fun keep busy stop play challenging   game angry win,[],0.513,pos,,positive_feedback
52,"Very high quality for a game. Fast, and crystal clear. Amazing that a game so popular, would be FREE! All levels to accomplish to become an Angry Birds Pro.~ Jessie",high quality game fast crystal clear amazing game popular free level accomplish angry bird pro.~ jessie,"[('Jessie', 'PERSON')]",0.54,pos,,positive_feedback
53,very very very very very very very very awesome &iexcl;!!!!! !!'! !!!!!!!! !!!!! !!!!! x. !&iexcl;!! cgdixjcv dnjdxjx gcfjxcb fvcv hxgrdh,awesome iexcl x. iexcl cgdixjcv dnjdxjx gcfjxcb fvcv hxgrdh,"[('x. !&iexcl', 'ORG')]",0.766,neu,,positive_feedback
54,"Watch out!  This is a very addicting game, but it is very fun for all ages!  Good way to kill time, or waste time.",watch   addicting game fun age   good way kill time waste time,[],0.505,neg,,positive_feedback
55,We all love this game.  It is fun for all ages.  We all cant wait till someone gets tired of it so we can get the tablet and play it.,love game   fun age   not wait till get tired tablet play,[],0.67,pos,,positive_feedback
56,We downloaded the free version for our tween's new Kindle Fire and everyone (from age 9 to 74) has had a blast playing the game which has many levels and challenges.  The graphics and sounds are great too.,download free version tween new kindle fire age 9 74 blast play game level challenge   graphic sound great,"[('Kindle Fire', 'LOC'), ('age 9 to 74', 'DATE')]",0.719,neu,,positive_feedback
57,Well I'm not what you would call a gamer but this game I found to be addicting. Makes me just nuts enough to try again when I fail.,gamer game find addict make nut try fail,[],0.73,neu,,general_comment
58,"What can I say that you probably don't already know, unless you've been living under a rock the last few years. It works like a champ on my kindle fire.",probably know live rock year work like champ kindle fire,"[('the last few years', 'DATE')]",0.771,neu,,general_comment
59,What can I say?  Ya Can't improve on perfection.  Great for traveling or times when you just need to relax.,  ya improve perfection   great travel time need relax,"[('Ya Ca', 'PERSON')]",0.563,pos,,positive_feedback
60,when angry birds space folding out on kindle fire? jrdhdhdh fhd dud Dvd dud db's dhdjsbd fhdbfjs sjdddhdx dud dud d,angry bird space fold kindle fire jrdhdhdh fhd dud dvd dud db dhdjsbd fhdbfjs sjdddhdx dud dud d,"[('db', 'GPE')]",0.523,neg,,general_comment
61,"Whenever I have probs operating a game, I will keep at it until I get at least 2 stars!  Helps pass the time, and helps to keep my mind active!",prob operate game 2 star   help pass time help mind active,"[('at least 2', 'CARDINAL')]",0.761,pos,,inquiry
62,When I first found about Angry Birds I didn't think much of it until I played it on my friends phone and then I was hooked. I got it for my Ipod and killed the battery on it. My husband bought me a Kindle Fire for Valentines day and playing Angry Birds o,find angry bird think play friend phone hook get ipod kill battery husband buy kindle fire valentine day play angry bird o,"[('first', 'ORDINAL'), ('Angry Birds', 'ORG'), ('Ipod', 'ORG'), ('a Kindle Fire for Valentines', 'ORG'), ('Angry Birds', 'ORG')]",0.689,neu,,general_comment
63,When I first got Angry Birds; I loved it and I couldn't stop playing it! I played it whenever I could. Hard levels that take a while to beat; sometimes I had to look up a walk-through to pass them. Plenty of levels. Once I completed all the levels; I sto,get angry bird love stop play play hard level beat look walk pass plenty level complete level sto,"[('first', 'ORDINAL'), ('Angry Birds', 'ORG')]",0.753,neu,,positive_feedback
64,When I first played this game I was hooked. I would spend hours just to defeat those pigs. My kids are even hooked on this game.,play game hook spend hour defeat pig kid hook game,"[('first', 'ORDINAL'), ('hours', 'TIME')]",0.816,neu,,general_comment
65,"When I have to wait to see say A doctor, DMV, the wife to get done shopping  and so on",wait doctor dmv wife shopping  ,"[('DMV', 'ORG')]",1.0,neu,,general_comment
66,"Who doesn't enjoy a classic game of angry birds, Tv shows do as they use the game. My friend's teach took her opossum away and started playing angry birds on it. LOL",enjoy classic game angry bird tv show use game friend teach take opossum away start play angry bird lol,"[('LOL', 'ORG')]",0.65,neu,,positive_feedback
67,who doesn't like angrybirds?but the paid version is better as it doesn't have all those annoying adds. blocking your shots!,like angrybirds?but pay version well annoying add block shot,[],0.601,neg,,general_comment
68,who doesn't like angry birds? i love angry birds! I don't know anyone who doesn't!  I love you angry birds! ! ! ! !!!!!!!!!!!!!!!!!!!!!!!!!!!!!!!!!!,like angry bird love angry bird know   love angry bird,[],0.472,pos,,positive_feedback
69,who doesn't love this app. everyone is my family enjoys playing this gamealways have fun playing angrybirds hope theyp come upwith newbirds,love app family enjoy play gamealway fun playing angrybird hope theyp come upwith newbird,[],0.493,pos,,positive_feedback
70,"Why does anyone hate this? Wi-fi required?You need wi-fi to download,so why are you complaining?Ads?They're so tiny!How can they bother you at all!Can't download?That doesn't make the game stupid.This is the best game of all time!!!....at least,all time ",hate wi fi required?you need wi fi download complaining?ads?they're tiny!how bother all!can't download?that game stupid.this good game time!!! time,[],0.738,neu,,negative_feedback
71,why do people give it low scores the adds are not disruptive great free game get it do not listen to low scores,people low score add disruptive great free game listen low score,[],0.603,pos,,positive_feedback
72,"WISH I HAD NEVER DOWNLOADED THIS GAME!!!!  I AM PLAYING IT ALL OF THE TIME!!!!  SOMETIMES I GET SOOO 'ANGRY' AT ONE OF THE PUZZLES, BUT CONTINUALLY GO BACK FOR MORE.",wish download game   play time   sooo angry puzzle continually,"[('TIME', 'ORG'), ('ANGRY', 'ORG'), ('ONE', 'CARDINAL')]",0.81,neu,,general_comment
73,works great on my kindle fire.It was I think the second free app I loaded an works great still to this day._Never had one problem.,work great kindle fire.it think second free app load work great day._never problem,"[('second', 'ORDINAL'), ('one', 'CARDINAL')]",0.597,pos,,positive_feedback
74,WOW angry birds is soooooooo fun expecialy on my kindle fire I love It and if I love it than its the best game in the UNIVERSE!!!!!!!!!!!!!! :-))))))) LOVE G.sonnier,wow angry bird soooooooo fun expecialy kindle fire love love good game universe love g.sonni,"[('WOW', 'ORG'), ('UNIVERSE', 'ORG')]",0.489,pos,,positive_feedback
75,"Wow, its great. why do u people complain? trust me and get it. Trust me, I'm a doctor(as far as u know)",wow great u people complain trust trust doctor(as far u know,[],0.5,pos,,positive_feedback
76,yes ads are annoying but its FREE! I love to launch those birds at them pigs. It makes me feel all giddy inside ha!,yes ad annoying free love launch bird pig make feel giddy inside ha,[],0.52,pos,,positive_feedback
77,Yes. If you are looking for a game for the Fire. This is it. It's a fun game to play.,yes look game fire fun game play,[],0.597,pos,,positive_feedback
78,"yipee Angry Birds! I don't have a cell phone so I've been coveting this game ever since my niece showed me how to play. Thank you for offering this on the new Kindle Fire HD, loving it. 5 stars.",yipee angry bird cell phone covet game niece show play thank offer new kindle fire hd love 5 star,"[('Angry Birds', 'ORG'), ('Kindle Fire HD', 'FAC'), ('5', 'CARDINAL')]",0.697,neu,,positive_feedback
79,you can play this app all day and all night. the first day I got it a completed half of the levels! stop reading reveiws BUY IT!,play app day night day get complete half level stop read reveiw buy,"[('all day', 'DATE'), ('the first day', 'DATE'), ('half', 'CARDINAL'), ('BUY', 'ORG')]",0.828,neu,,general_comment
80,you get to kill all these pigs and once you start you cant stop Im usually always on it buy it or else,kill pig start not stop m usually buy,[],0.761,neu,,general_comment
81,"You have to get it because its a very very very fun! The persons who put 1star are crazy. It'd really stupid that they don't get it.Your wasting your time reading this, get this app or game now!",fun person 1star crazy stupid it.your waste time read app game,"[('1star', 'DATE')]",0.722,neg,,positive_feedback
82,"You know how the full version says, and I quote, Ad-Free? Well, this isn't the full version. This is the free version. And consider how the app only has ads to deal with - it doesn't restrict you to a certain amount of levels. It's not, as I call it, a s",know version say quote ad free version free version consider app ad deal restrict certain level s,[],0.832,neu,,inquiry
83,You will be so hooked and addicted to this game.Let me just say this is a very funnnn game and will not be able to stop playing.. have fun!!!!  (:,hooked addict game.let funnnn game able stop play fun  ,[],0.69,neu,,positive_feedback
84,you will love this game if you get it. if u gave this game less than a five star rating you would have to be a lunitic,love game u give game star rating lunitic,"[('less than a five', 'CARDINAL')]",0.861,neu,,positive_feedback
85,They call it three next mario??? Are the 'professional reviewers' high??? Ask you do is fling birds at bones again and again and again. Has zero replay value.,mario professional reviewer high ask fle bird bone zero replay value,"[('three', 'CARDINAL'), ('zero', 'CARDINAL')]",0.889,neu,,general_comment
86,"Angry People in my book!  Any moron who would waste their time playing azimuth slingshot and call it a cultural phenomenon is ... what is the word (???) ... oh yes, a moron!!!  Those 5 minutes I played this thing still scar me!",angry people book   moron waste time play azimuth slingshot cultural phenomenon word oh yes moron   5 minute play thing scar,"[('Angry People', 'PERSON'), ('Those 5 minutes', 'TIME')]",0.63,neu,,negative_feedback
87,Argry Birds is for free to play a games on your kindlefireBecause it for free. and to play right.,argry bird free play game kindlefirebecause free play right,[],0.568,pos,,general_comment
88,"cant stand this game. love the concept and played many of the same type. I have to give the developer credit for creating a ton of levels, keeps you going for hours. sounds are irritating. the constant chirps are annoying as heck, play this with the soun",not stand game love concept play type developer credit create ton level keep go hour sound irritate constant chirp annoying heck play soun,"[('a ton', 'QUANTITY'), ('hours', 'TIME')]",0.672,neu,,positive_feedback
89,Don't really know the point of this game.  It's almost impossible to knock the stupid birds down.  Why waste your time on this one?,know point game   impossible knock stupid bird   waste time,[],0.78,neu,,negative_feedback
90,Eden or mine craft will make apps more buy able. Eden and mine are fun fun fun. together we stand strong for our apps come come. lets fight for Eden and mine craft pocket addition. LETS GO ON STRIKE!!!this is madden.NO THIS IS FREEDEM OF APPS!!!!!!!!!!!!,eden craft app buy able eden fun fun fun stand strong app come come lets fight eden craft pocket addition let strike!!!this madden.no freedem app,"[('Eden', 'LOC'), ('Eden', 'LOC')]",0.707,neu,,positive_feedback
91,first the game is ok not great. second it is way over rated all it is is a sling shot and you use birds to kill pigs...over rated,game ok great second way rate sling shot use bird kill pig rate,"[('first', 'ORDINAL'), ('second', 'ORDINAL')]",0.71,neu,,positive_feedback
92,Game is rather...retarded for lack of a better word.  Wouldn't and haven't recommended to anyone as I dont know anyone that would bother with it.,game retarded lack well word   recommend not know bother,[],0.699,pos,,general_comment
